{"$schema":"https://json-schema.org/draft/2020-12/schema","description":"One file swaps ASR or LLM independently. It never edits lifemate/agent.py: loader.py maps each section onto the real lifemate constructors and reports anything unexpressible as a GAP instead of silently dropping it. This JSON Schema is documentation; loader.py enforces the same rules in stdlib Python (jsonschema is optional in the repo) and is the authority on CPU.","properties":{"agent_unchanged":{"default":true,"description":"Assertion, not a setting: swapping checkpoints must never require an agent.py change. If a swap seems to need one, that is a GAP to report, not an edit to make here.","type":"boolean"},"asr":{"properties":{"beam_size":{"default":1,"description":"Only 1 is expressible, for the same reason.","type":"integer"},"checkpoint":{"description":"Local checkpoint directory (preferred for a fine-tune) or HF id. For faster-whisper this must be a CTranslate2-converted directory; a transformers-format directory will fail at load (see README GAP A1).","type":"string"},"compute_type":{"default":"float16","type":"string"},"device":{"default":"cuda","type":"string"},"greedy":{"default":true,"description":"Only true is expressible: transcribe() hardcodes beam_size=1.","type":"boolean"},"hotwords":{"default":null,"description":"Any non-empty value is a GAP: no constructor/transcribe parameter exists.","type":["array","null"]},"initial_prompt":{"default":null,"description":"Any non-empty value is a GAP, same reason.","type":["string","null"]},"kind":{"default":"faster-whisper","description":"transformers is declarable but UNBUILDABLE today: lifemate/asr.py has no transformers ASR class (GAP, see loader.resolve_asr_kwargs).","enum":["faster-whisper","transformers"]},"language":{"default":"vi","description":"Only 'vi' is expressible: FasterWhisperASR.transcribe() hardcodes language='vi'.","type":"string"},"revision":{"default":null,"description":"Any non-null value is a GAP: FasterWhisperASR has no revision parameter. Use a local directory to pin exactly.","type":["string","null"]}},"required":["checkpoint"],"type":"object"},"llm":{"properties":{"chat_template_source":{"default":null,"description":"If set and != checkpoint, GAP: both generators use the checkpoint's own chat template.","type":["string","null"]},"checkpoint":{"description":"Local checkpoint directory (preferred for a fine-tune) or HF id.","type":"string"},"device":{"default":null,"description":"Used by TransformersGenerator only; ignored (warning) for vllm.","type":["string","null"]},"kind":{"default":"vllm","enum":["vllm","transformers"]},"load_kind":{"default":"full","description":"full = weights as stored; merged = a fine-tune already merged into full weights (loads like full); adapter = LoRA/PEFT adapter directory, UNBUILDABLE today (GAP: no constructor takes base_model + adapter_path).","enum":["full","merged","adapter"]},"max_context_tokens":{"default":16384,"description":"Must be <= 16384. Enforced by loader validation, NOT by either generator (neither takes it; see loader warning).","type":"integer"},"max_tokens":{"default":512,"description":"Used by VLLMGenerator; TransformersGenerator hardcodes 512, so any other value is a GAP for kind=transformers.","type":"integer"},"revision":{"default":"","description":"HF revision. For a local directory this is informational; the directory itself is the pin.","type":"string"},"seed":{"default":42,"description":"Used by VLLMGenerator; ignored (with a warning) by TransformersGenerator, which has no seed parameter.","type":"integer"},"stop":{"default":null,"description":"Any non-empty list is a GAP: stopping is the template stop token plus the {\"stop\": true} rule in parse_model_output.","type":["array","null"]},"temperature":{"default":0.0,"description":"Only 0.0 is expressible: vLLM hardcodes 0.0, transformers hardcodes do_sample=False (greedy).","type":"number"},"tokenizer_source":{"default":null,"description":"If set and != checkpoint, GAP: both generators use AutoTokenizer.from_pretrained(checkpoint).","type":["string","null"]}},"required":["checkpoint"],"type":"object"},"name":{"description":"Human label for this pair, e.g. baseline-asr + sft-llm-v1. Not an identity: identity is checkpoint + revision/hash in the manifest.","type":"string"},"schema_version":{"const":1}},"required":["schema_version","asr","llm"],"title":"LifeMate checkpoint config v1 (single config, ASR + LLM, independent swap)","type":"object"}