{"agent_unchanged":true,"asr":{"beam_size":1,"checkpoint":"vinai/PhoWhisper-small","compute_type":"float16","device":"cuda","greedy":true,"hotwords":null,"initial_prompt":null,"kind":"faster-whisper","language":"vi","revision":null},"llm":{"chat_template_source":null,"checkpoint":"Qwen/Qwen3-4B-Instruct-2507","device":null,"kind":"vllm","load_kind":"full","max_context_tokens":16384,"max_tokens":512,"revision":"cdbee75","seed":42,"stop":null,"temperature":0.0,"tokenizer_source":null},"name":"baseline (recommended.json equivalent, checkpoint-config form)","schema_version":1}